{"builder_contract":"MLB_2026_VERSIONED_FILE_PHASE_AUTHORITY_BUILDER_V1","builder_version":"1","classification_sha256":"97b8a3e13d025a94976ede565278f9517eb63dcb77746157513718f30afcd524","contract_name":"MLB_2026_VERSIONED_FILE_PHASE_AUTHORITY_V1","deterministic_source_set_sha256":"e31db6ad53af4eaeda027b98708fa1988b8477a6c9e708571c88be3ee48021d8","distinct_game_pk_count":2954,"game_pk_population_sha256":"55fcf53b20bd1c400e00d1ad4250fab5f435a5a0d87ca7888fb96eda724d4231","normalized_phase_counts":{"POSTSEASON":35,"PRESEASON":489,"REGULAR_SEASON":2430},"parent_descriptor_path":"../v5/descriptor.json","parent_descriptor_sha256":"fa639c543ba77bab4ca4a5a853ec78cb10eaf2163b7cebddad6156eeed4d941d","parent_snapshot_id":"MLB_2026_GAME_PHASE_AUTHORITY_2EAC7837294784C9","proposal_path":"canonical_game_phase_full_snapshot.jsonl","proposal_sha256":"7124d9baa2df2b88f9572c0e9492307e5c794bd2abd6bdcc20460f1bcd901ae2","raw_game_type_counts":{"D":16,"E":38,"F":9,"L":10,"R":2430,"S":451},"root_snapshot_id":"MLB_2026_GAME_PHASE_AUTHORITY_V1","row_count":2954,"scheduled_date_from":"2026-02-20","scheduled_date_through":"2026-10-20","schema_version":1,"snapshot_id":"MLB_2026_GAME_PHASE_AUTHORITY_7124D9BAA2DF2B88","snapshot_status":"GOVERNED","source_file_count":472,"source_manifest_path":"retained_source_manifest.jsonl","source_manifest_sha256":"4a3c921de3fe76cc2312c3dcb323c50a4de3d767e159f1975e68c8796a1620f6","source_observation_count":13562,"supported_season":2026,"v1_authority_records_sha256":"5a7cdc460cc42ca2b4ed328c74e978b9da6967f95d7a7c4ba888b3b8d3401a84","v1_proposal_sha256":"b4f04273225643f691d438b492af8c36a40f2b63f62c34f60442261abc850879","v1_source_manifest_sha256":"766ea3ac7c230ea149e3189cd12b2070df645c27a16b86100143517d79456100"}
