{"builder_contract":"MLB_2026_VERSIONED_FILE_PHASE_AUTHORITY_BUILDER_V1","builder_version":"1","classification_sha256":"560d3008f3d015e8d37d6ae098c29e415412aa6171c2d157a505cc7bacc58b31","contract_name":"MLB_2026_VERSIONED_FILE_PHASE_AUTHORITY_V1","deterministic_source_set_sha256":"073ca00517f41bc58eb7b668375dd445356f92ffafa07b3c98200f90e98b689b","distinct_game_pk_count":2923,"game_pk_population_sha256":"8a8ed2b02f6286714b3f865c4f0fc5dfbd3ce6f5445ba2d8357761cada91bb4a","normalized_phase_counts":{"POSTSEASON":4,"PRESEASON":489,"REGULAR_SEASON":2430},"parent_descriptor_path":"../v1/descriptor.json","parent_descriptor_sha256":"543fda06d3c066bb6f0608ee8c05987829216fa441459a8fc08b4f87ee8c245a","parent_snapshot_id":"MLB_2026_GAME_PHASE_AUTHORITY_V1","proposal_path":"canonical_game_phase_full_snapshot.jsonl","proposal_sha256":"2f576b2eae1c0041c98db9ac04a0406675aee0e1b68e16435dd32f91752d6502","raw_game_type_counts":{"E":38,"F":4,"R":2430,"S":451},"root_snapshot_id":"MLB_2026_GAME_PHASE_AUTHORITY_V1","row_count":2923,"scheduled_date_from":"2026-02-20","scheduled_date_through":"2026-09-30","schema_version":1,"snapshot_id":"MLB_2026_GAME_PHASE_AUTHORITY_2F576B2EAE1C0041","snapshot_status":"GOVERNED","source_file_count":465,"source_manifest_path":"retained_source_manifest.jsonl","source_manifest_sha256":"350977e0f8c7993bdff30eecc5f26b575273c731bfcaae31286eb2507f17464f","source_observation_count":9822,"supported_season":2026,"v1_authority_records_sha256":"5a7cdc460cc42ca2b4ed328c74e978b9da6967f95d7a7c4ba888b3b8d3401a84","v1_proposal_sha256":"b4f04273225643f691d438b492af8c36a40f2b63f62c34f60442261abc850879","v1_source_manifest_sha256":"766ea3ac7c230ea149e3189cd12b2070df645c27a16b86100143517d79456100"}
