{"builder_contract":"MLB_2026_VERSIONED_FILE_PHASE_AUTHORITY_BUILDER_V1","builder_version":"1","classification_sha256":"6d0f6bca13f84871d4dc24cc09469fe39bfcf2dfd79b69aa50db679e49bdc6d3","contract_name":"MLB_2026_VERSIONED_FILE_PHASE_AUTHORITY_V1","deterministic_source_set_sha256":"f4ff0c24c2a849e2f7e3cd368cc502dbecdddb0c440886af526c6448a8873951","distinct_game_pk_count":2919,"game_pk_population_sha256":"4f76d2d50e9289cc72d1fb7ada762cea1d59fcaa082e0739f554cbb4e972174c","normalized_phase_counts":{"PRESEASON":489,"REGULAR_SEASON":2430},"parent_descriptor_path":null,"parent_descriptor_sha256":null,"parent_snapshot_id":null,"proposal_path":"../../../../../docs/contracts/mlb_2026_canonical_phase_source_completion_v1/canonical_backfill_proposal/canonical_game_phase_backfill_proposal.jsonl","proposal_sha256":"b4f04273225643f691d438b492af8c36a40f2b63f62c34f60442261abc850879","raw_game_type_counts":{"E":38,"R":2430,"S":451},"root_snapshot_id":"MLB_2026_GAME_PHASE_AUTHORITY_V1","row_count":2919,"scheduled_date_from":"2026-02-20","scheduled_date_through":"2026-09-27","schema_version":1,"snapshot_id":"MLB_2026_GAME_PHASE_AUTHORITY_V1","snapshot_status":"GOVERNED","source_file_count":464,"source_manifest_path":"../../../../../docs/contracts/mlb_2026_canonical_phase_source_completion_v1/canonical_backfill_proposal/retained_source_manifest.jsonl","source_manifest_sha256":"766ea3ac7c230ea149e3189cd12b2070df645c27a16b86100143517d79456100","source_observation_count":9092,"supported_season":2026,"v1_authority_records_sha256":"5a7cdc460cc42ca2b4ed328c74e978b9da6967f95d7a7c4ba888b3b8d3401a84","v1_proposal_sha256":"b4f04273225643f691d438b492af8c36a40f2b63f62c34f60442261abc850879","v1_source_manifest_sha256":"766ea3ac7c230ea149e3189cd12b2070df645c27a16b86100143517d79456100"}
